{
  "schema_version": "accurate-ground-truth-v1",
  "sample_id": "synthetic-valid-001",
  "is_ground_truth": true,
  "machine_generated": false,
  "media": {"sha256": "aaaaaaaaaaaaaaaaaaaaaaaaaaaaaaaaaaaaaaaaaaaaaaaaaaaaaaaaaaaaaaaa", "duration_ms": 1000, "source_type": "synthetic_test_only", "rights_confirmed": true},
  "coverage_tags": ["schema_test"],
  "human_verified_transcript": "测试文本",
  "segments": [{"segment_id": "reference-1", "start_ms": 0, "end_ms": 1000, "text": "测试文本", "tokens": [], "critical_tokens": []}],
  "ambiguous_regions": [],
  "verification": {"status": "HUMAN_VERIFIED", "first_pass_completed": true, "second_pass_completed": true, "verified_at": "2026-08-10T00:00:00+10:00", "verification_method": "two_pass_audio_video_review"}
}
